{
  "merchants": [
    {
      "id": 1,
      "name": "Sample Restaurant",
      "phoneNumber": "030120765890",
      "currency": "EUR",
      "locale": "de_DE",
      "timezone": "19:30:00",
      "location": {
        "coordinates": "string",
        "address": "string"
      },
      "reviewScore": "string",
      "tagGroups": [
        "string"
      ],
      "images": [
        "string"
      ],
      "documents": [
        "string"
      ],
      "links": [
        "string"
      ],
      "bookable": true,
      "openingTimes": {
        "standardOpeningTimes": "19:30:00"
      },
      "ccvEnabled": true,
      "chain": {
        "id": 1,
        "name": "Sample Restaurant"
      },
      "ivrRedirectNumber": "string",
      "shortDescription": "Window table preferred if available.",
      "longDescription": "Window table preferred if available."
    }
  ],
  "size": 1,
  "offset": 1,
  "limit": 1
}